[
    {
        "id": "gsap-portfolio",
        "date": "2026.02.07",
        "baseFilename": "2026-02-07-gsap-portfolio",
        "emoji": "âœ¨",
        "tags": ["GSAP", "CSS Grid", "GitHub Pages"]
    },
    {
        "id": "renewal",
        "date": "2026.02.04",
        "baseFilename": "2026-02-04-renewal",
        "emoji": "ğŸ”„",
        "tags": ["Design", "Architecture"]
    },
    {
        "id": "i18n-multilingual",
        "date": "2026.02.01",
        "baseFilename": "2026-02-01-i18n-multilingual",
        "emoji": "ğŸŒ",
        "tags": ["i18next", "JA/EN"]
    },
    {
        "id": "nextjs-supabase-auth",
        "date": "2026.01.27",
        "baseFilename": "2026-01-27-nextjs-supabase-auth",
        "emoji": "ğŸ”",
        "tags": ["Next.js", "Supabase", "OAuth"]
    },
    {
        "id": "fitbit",
        "date": "2026.01.20",
        "baseFilename": "2026-01-20-fitbit",
        "emoji": "âŒš",
        "tags": ["Fitbit API", "Rate Limit"]
    },
    {
        "id": "css-bento-layout",
        "date": "2026.01.15",
        "baseFilename": "2026-01-15-css-bento-layout",
        "emoji": "ğŸ±",
        "tags": ["CSS Grid", "Bento Layout", "Responsive"]
    },
    {
        "id": "github-pages-deploy",
        "date": "2026.01.10",
        "baseFilename": "2026-01-10-github-pages-deploy",
        "emoji": "ğŸš€",
        "tags": ["GitHub Pages", "Deploy", "DNS"]
    },
    {
        "id": "web-performance",
        "date": "2026.01.05",
        "baseFilename": "2026-01-05-web-performance",
        "emoji": "âš¡",
        "tags": ["Lighthouse", "Performance", "SEO"]
    }
]